{
  "version": 2,
  "type": "source-program-scene-query",
  "commandId": "scn_aaaaaaaaaaaaaaaa",
  "assignmentId": "asn_aaaaaaaaaaaaaaaa",
  "programId": "prg_aaaaaaaaaaaaaaaa",
  "programEpoch": 1,
  "leaseId": "lea_aaaaaaaaaaaaaaaa",
  "fencingRevision": 1,
  "issuedAt": 1788958800000,
  "expiresAt": 1788958804000
}
